{
  "schemaVersion": "1.0.0",
  "candidate": "focused",
  "environment": "macos",
  "artifactManifest": {
    "path": "evidence/nested-evidence.json",
    "sha256": "555a6509198dff91aae388d9b843155ea7a7cf46d7db3748ee568728f3c76e4c",
    "mediaType": "application/json"
  },
  "spdxSbom": {
    "path": "evidence/nested-evidence.json",
    "sha256": "555a6509198dff91aae388d9b843155ea7a7cf46d7db3748ee568728f3c76e4c",
    "mediaType": "application/json"
  },
  "notices": {
    "path": "evidence/nested-evidence.json",
    "sha256": "555a6509198dff91aae388d9b843155ea7a7cf46d7db3748ee568728f3c76e4c",
    "mediaType": "application/json"
  },
  "slsaProvenance": {
    "path": "evidence/nested-evidence.json",
    "sha256": "555a6509198dff91aae388d9b843155ea7a7cf46d7db3748ee568728f3c76e4c",
    "mediaType": "application/json"
  },
  "dsseEnvelope": {
    "path": "evidence/nested-evidence.json",
    "sha256": "555a6509198dff91aae388d9b843155ea7a7cf46d7db3748ee568728f3c76e4c",
    "mediaType": "application/json"
  },
  "ciInvocation": {
    "path": "evidence/nested-evidence.json",
    "sha256": "555a6509198dff91aae388d9b843155ea7a7cf46d7db3748ee568728f3c76e4c",
    "mediaType": "application/json"
  },
  "externalContractLockDigest": "52e8ff32f22d34ad7a15151d1f119361c03f61d3e2bcc33e5f8a47b5ac36d83e"
}
